{
  "schema": "https://github.com/CheeseKirby/memes/schema/xin-sanguo/v1",
  "project": {
    "name": "新三国专属梗库",
    "english_name": "New Three Kingdoms Meme Index",
    "focus": "中文互联网近年的《新三国》相关梗，重点参考 B 站 UP 主“吃蛋挞的折棒”的《三国杀up锐评新三国 / 吐槽新三国》系列。",
    "primary_index": "index.json",
    "notes": [
      "本库优先保存梗条目、出处、标签、适用语境和少量明确梗截图。",
      "B 站评论区内容只做低频候选提取，入库前需要人工复核。",
      "有截图的条目优先使用 assets/screenshots/，没有截图的条目使用 assets/cards/ SVG 文字卡兜底。"
    ]
  },
  "updated_at": "2026-10-17T09:27:15Z",
  "pack": "quotes",
  "item_count": 11,
  "items": [
    {
      "id": "xsg-comment-little-glutton",
      "title": "小馋猫",
      "item_type": "meme",
      "summary": "评论区用于调侃“你还挺爱看/挺爱吃这口”的短回复梗。",
      "aliases": [
        "馋这口"
      ],
      "tags": [
        "新三国",
        "折棒",
        "评论区梗",
        "短句",
        "回复",
        "反应图"
      ],
      "tone": [
        "调侃",
        "亲昵",
        "阴阳怪气"
      ],
      "language": "zh",
      "safe": true,
      "usage": [
        "调侃对方明明痛苦但还想看",
        "看到别人主动找乐子时回复"
      ],
      "primary_bvid": "BV1rjyYYjEjQ",
      "source_url": "https://www.bilibili.com/video/BV1rjyYYjEjQ",
      "source_kind": "bilibili_comment_candidate",
      "image_status": "generated_card",
      "schema": "https://github.com/CheeseKirby/memes/schema/xin-sanguo/v1",
      "source": "curated_xin_sanguo_memes",
      "added_at": "2026-10-17T09:27:15Z",
      "updated_at": "2026-10-17T09:27:15Z",
      "image_url": "https://raw.githubusercontent.com/CheeseKirby/memes/main/assets/cards/xsg-comment-little-glutton.svg",
      "thumbnail_url": "https://raw.githubusercontent.com/CheeseKirby/memes/main/assets/cards/xsg-comment-little-glutton.svg",
      "image_refs": [
        {
          "kind": "bilibili_cover",
          "status": "reference_only",
          "url": "https://i1.hdslb.com/bfs/archive/46b5d9e65943f69a20b7e079a55e5d5f02122868.jpg",
          "note": "Bilibili video cover URL; not rehosted by this repository."
        },
        {
          "kind": "generated_card",
          "status": "repo_owned",
          "path": "assets/cards/xsg-comment-little-glutton.svg",
          "url": "https://raw.githubusercontent.com/CheeseKirby/memes/main/assets/cards/xsg-comment-little-glutton.svg",
          "note": "仓库生成的文字梗图卡，不是视频截图。"
        }
      ],
      "bilibili_url": "https://www.bilibili.com/video/BV1rjyYYjEjQ",
      "episode": 1,
      "episode_title": "三国杀up锐评新三国：第一集怎么连刘关张都消失了？",
      "episode_pubdate": "2024-10-21T02:00:00Z",
      "episode_stats": {
        "view": 9265816,
        "danmaku": 23342,
        "reply": 12633,
        "favorite": 71838,
        "coin": 50518,
        "share": 104517,
        "like": 167403
      },
      "search_text": "小馋猫 评论区用于调侃“你还挺爱看/挺爱吃这口”的短回复梗。 馋这口 新三国 折棒 评论区梗 短句 回复 反应图 调侃 亲昵 阴阳怪气 调侃对方明明痛苦但还想看 看到别人主动找乐子时回复 三国杀up锐评新三国：第一集怎么连刘关张都消失了？"
    },
    {
      "id": "xsg-episode-bright-future",
      "title": "我们都有光明的未来",
      "item_type": "meme",
      "summary": "适合形容所有人都被剧情安排得很荒诞，但表面上仍然充满希望。",
      "aliases": [
        "光明的未来"
      ],
      "tags": [
        "新三国",
        "折棒",
        "视频来源",
        "台词梗",
        "回复"
      ],
      "tone": [
        "黑色幽默",
        "反讽",
        "乐观"
      ],
      "language": "zh",
      "safe": true,
      "usage": [
        "反讽式鼓励",
        "大家一起完蛋但很乐观"
      ],
      "primary_bvid": "BV1eEDaYmENQ",
      "source_url": "https://www.bilibili.com/video/BV1eEDaYmENQ",
      "image_status": "screenshot_target",
      "schema": "https://github.com/CheeseKirby/memes/schema/xin-sanguo/v1",
      "source": "curated_xin_sanguo_memes",
      "added_at": "2026-10-17T09:27:15Z",
      "updated_at": "2026-10-17T09:27:15Z",
      "image_url": "https://raw.githubusercontent.com/CheeseKirby/memes/main/assets/cards/xsg-episode-bright-future.svg",
      "thumbnail_url": "https://raw.githubusercontent.com/CheeseKirby/memes/main/assets/cards/xsg-episode-bright-future.svg",
      "image_refs": [
        {
          "kind": "bilibili_cover",
          "status": "reference_only",
          "url": "https://i2.hdslb.com/bfs/archive/c8e3c57bde85e8d87a2087ee62afbee7c52f0bd1.jpg",
          "note": "Bilibili video cover URL; not rehosted by this repository."
        },
        {
          "kind": "bilibili_videoshot_storyboard",
          "status": "source_preview",
          "urls": [
            "https://bimp.hdslb.com/videoshotpvhdboss/26675249945_ya2gtb-0001.jpg"
          ],
          "pvdata_url": "https://boss.hdslb.com/videoshotpvhdboss/26675249945_ya2gtb.bin",
          "grid": {
            "columns": 10,
            "rows": 10,
            "cell_width": 480,
            "cell_height": 270
          },
          "frame_hint": "找“我们都有光明的未来”标题语境或相关角色画面。",
          "repository_image_path": "assets/screenshots/xsg-episode-bright-future.jpg",
          "note": "用于定位和复核截图的 B 站预览帧网格。"
        },
        {
          "kind": "generated_card",
          "status": "repo_owned",
          "path": "assets/cards/xsg-episode-bright-future.svg",
          "url": "https://raw.githubusercontent.com/CheeseKirby/memes/main/assets/cards/xsg-episode-bright-future.svg",
          "note": "仓库生成的文字梗图卡，不是视频截图。"
        }
      ],
      "bilibili_url": "https://www.bilibili.com/video/BV1eEDaYmENQ",
      "episode": 10,
      "episode_title": "三国杀up锐评新三国10：李儒变太监，刘备跳明反，我们都有光明的未来",
      "episode_pubdate": "2024-11-09T02:00:00Z",
      "episode_stats": {
        "view": 3053888,
        "danmaku": 11477,
        "reply": 1442,
        "favorite": 6499,
        "coin": 16469,
        "share": 1749,
        "like": 57116
      },
      "search_text": "我们都有光明的未来 适合形容所有人都被剧情安排得很荒诞，但表面上仍然充满希望。 光明的未来 新三国 折棒 视频来源 台词梗 回复 黑色幽默 反讽 乐观 反讽式鼓励 大家一起完蛋但很乐观 三国杀up锐评新三国10：李儒变太监，刘备跳明反，我们都有光明的未来"
    },
    {
      "id": "xsg-event-golden-uprising",
      "title": "黄金起义",
      "item_type": "meme",
      "summary": "用于指代新三国式历史称呼错位、文本误读或评论区二创出来的谐音/误称。",
      "aliases": [
        "黄巾起义变体"
      ],
      "tags": [
        "新三国",
        "历史梗",
        "错位",
        "评论区梗",
        "台词梗"
      ],
      "tone": [
        "误读",
        "抽象",
        "吐槽"
      ],
      "language": "zh",
      "safe": true,
      "usage": [
        "历史名词被玩坏",
        "评论区集体复读误称"
      ],
      "source_url": "https://new-three-kingdoms.fandom.com/zh/wiki/%E9%BB%84%E9%87%91%E8%B5%B7%E4%B9%89",
      "image_status": "needs_curated_image",
      "schema": "https://github.com/CheeseKirby/memes/schema/xin-sanguo/v1",
      "source": "curated_xin_sanguo_memes",
      "added_at": "2026-10-17T09:27:15Z",
      "updated_at": "2026-10-17T09:27:15Z",
      "image_url": "https://raw.githubusercontent.com/CheeseKirby/memes/main/assets/cards/xsg-event-golden-uprising.svg",
      "thumbnail_url": "https://raw.githubusercontent.com/CheeseKirby/memes/main/assets/cards/xsg-event-golden-uprising.svg",
      "image_refs": [
        {
          "kind": "generated_card",
          "status": "repo_owned",
          "path": "assets/cards/xsg-event-golden-uprising.svg",
          "url": "https://raw.githubusercontent.com/CheeseKirby/memes/main/assets/cards/xsg-event-golden-uprising.svg",
          "note": "仓库生成的文字梗图卡，不是视频截图。"
        }
      ],
      "search_text": "黄金起义 用于指代新三国式历史称呼错位、文本误读或评论区二创出来的谐音/误称。 黄巾起义变体 新三国 历史梗 错位 评论区梗 台词梗 误读 抽象 吐槽 历史名词被玩坏 评论区集体复读误称 "
    },
    {
      "id": "xsg-law-shi-bu-guo-san",
      "title": "事不过三",
      "item_type": "meme",
      "summary": "新三国式重复桥段被观众总结成规律时使用，适合标注同一套路第三次出现。",
      "aliases": [
        "三次定律"
      ],
      "tags": [
        "新三国",
        "定律",
        "理论梗",
        "复读",
        "吐槽"
      ],
      "tone": [
        "总结",
        "吐槽"
      ],
      "language": "zh",
      "safe": true,
      "usage": [
        "同类剧情反复出现",
        "某个梗第三次复现"
      ],
      "source_url": "https://new-three-kingdoms.fandom.com/zh/wiki/%E4%BA%8B%E4%B8%8D%E8%BF%87%E4%B8%89",
      "image_status": "needs_curated_image",
      "schema": "https://github.com/CheeseKirby/memes/schema/xin-sanguo/v1",
      "source": "curated_xin_sanguo_memes",
      "added_at": "2026-10-17T09:27:15Z",
      "updated_at": "2026-10-17T09:27:15Z",
      "image_url": "https://raw.githubusercontent.com/CheeseKirby/memes/main/assets/cards/xsg-law-shi-bu-guo-san.svg",
      "thumbnail_url": "https://raw.githubusercontent.com/CheeseKirby/memes/main/assets/cards/xsg-law-shi-bu-guo-san.svg",
      "image_refs": [
        {
          "kind": "generated_card",
          "status": "repo_owned",
          "path": "assets/cards/xsg-law-shi-bu-guo-san.svg",
          "url": "https://raw.githubusercontent.com/CheeseKirby/memes/main/assets/cards/xsg-law-shi-bu-guo-san.svg",
          "note": "仓库生成的文字梗图卡，不是视频截图。"
        }
      ],
      "search_text": "事不过三 新三国式重复桥段被观众总结成规律时使用，适合标注同一套路第三次出现。 三次定律 新三国 定律 理论梗 复读 吐槽 总结 吐槽 同类剧情反复出现 某个梗第三次复现 "
    },
    {
      "id": "xsg-quote-dont-be-angry",
      "title": "不要愤怒",
      "item_type": "meme",
      "summary": "用于劝人冷静，也常被反讽为越劝越让人火大。",
      "aliases": [
        "愤怒会降低你的智慧"
      ],
      "tags": [
        "新三国",
        "台词梗",
        "短句",
        "回复",
        "反应图"
      ],
      "tone": [
        "劝解",
        "反讽",
        "冷静"
      ],
      "language": "zh",
      "safe": true,
      "usage": [
        "劝人别急",
        "调侃对方上头"
      ],
      "source_url": "https://new-three-kingdoms.fandom.com/zh/wiki/%E4%B8%8D%E8%A6%81%E6%84%A4%E6%80%92",
      "image_status": "needs_curated_image",
      "schema": "https://github.com/CheeseKirby/memes/schema/xin-sanguo/v1",
      "source": "curated_xin_sanguo_memes",
      "added_at": "2026-10-17T09:27:15Z",
      "updated_at": "2026-10-17T09:27:15Z",
      "image_url": "https://raw.githubusercontent.com/CheeseKirby/memes/main/assets/cards/xsg-quote-dont-be-angry.svg",
      "thumbnail_url": "https://raw.githubusercontent.com/CheeseKirby/memes/main/assets/cards/xsg-quote-dont-be-angry.svg",
      "image_refs": [
        {
          "kind": "generated_card",
          "status": "repo_owned",